<?xml version="1.0" encoding="UTF-8"?>
<list xmlns:xsi="http://www.w3.org/2001/XMLSchema-instance" xsi:noNamespaceSchemaLocation="../../xsd/multisell.xsd">
	<npcs>
		<npc>-1</npc> <!-- CB -->
	</npcs>
	<item>
		<!-- Adena -->
		<ingredient count="161659000" id="57" />
		<production count="1" id="80261" />
	</item>
	<item>
		<!-- Adena -->
		<ingredient count="161659000" id="57" />
		<production count="1" id="80262" />
	</item>
	<item>
		<!-- Adena -->
		<ingredient count="161659000" id="57" />
		<production count="1" id="80263" />
	</item>
	<item>
		<!-- Adena -->
		<ingredient count="161659000" id="57" />
		<production count="1" id="80264" />
	</item>
	<item>
		<!-- Adena -->
		<ingredient count="161659000" id="57" />
		<production count="1" id="80265" />
	</item>
	<item>
		<!-- Adena -->
		<ingredient count="161659000" id="57" />
		<production count="1" id="80266" />
	</item>
	<item>
		<!-- Adena -->
		<ingredient count="161659000" id="57" />
		<production count="1" id="80267" />
	</item>
	<item>
		<!-- Adena -->
		<ingredient count="161659000" id="57" />
		<production count="1" id="80268" />
	</item>
	<item>
		<!-- Adena -->
		<ingredient count="161659000" id="57" />
		<production count="1" id="80269" />
	</item>
	<item>
		<!-- Adena -->
		<ingredient count="161659000" id="57" />
		<production count="1" id="80270" />
	</item>
	<item>
		<!-- Adena -->
		<ingredient count="161659000" id="57" />
		<production count="1" id="80271" />
	</item>
	<item>
		<!-- Adena -->
		<ingredient count="161659000" id="57" />
		<production count="1" id="80272" />
	</item>
	<item>
		<!-- Adena -->
		<ingredient count="161659000" id="57" />
		<production count="1" id="80273" />
	</item>
	<item>
		<!-- Adena -->
		<ingredient count="161659000" id="57" />
		<production count="1" id="80274" />
	</item>
	<item>
		<!-- Adena -->
		<ingredient count="161659000" id="57" />
		<production count="1" id="80275" />
	</item>
	<item>
		<!-- Adena -->
		<ingredient count="161659000" id="57" />
		<production count="1" id="80276" />
	</item>
	<item>
		<!-- Adena -->
		<ingredient count="161659000" id="57" />
		<production count="1" id="80277" />
	</item>
	<item>
		<!-- Adena -->
		<ingredient count="161659000" id="57" />
		<production count="1" id="80250" />
	</item>
	<item>
		<!-- Adena -->
		<ingredient count="161659000" id="57" />
		<production count="1" id="80251" />
	</item>
	<item>
		<!-- Adena -->
		<ingredient count="161659000" id="57" />
		<production count="1" id="80252" />
	</item>
	<item>
		<!-- Adena -->
		<ingredient count="161659000" id="57" />
		<production count="1" id="80253" />
	</item>
	<item>
		<!-- Adena -->
		<ingredient count="161659000" id="57" />
		<production count="1" id="80254" />
	</item>
	<item>
		<!-- Adena -->
		<ingredient count="161659000" id="57" />
		<production count="1" id="80255" />
	</item>
	<item>
		<!-- Adena -->
		<ingredient count="161659000" id="57" />
		<production count="1" id="80256" />
	</item>
	<item>
		<!-- Adena -->
		<ingredient count="161659000" id="57" />
		<production count="1" id="80257" />
	</item>
	<item>
		<!-- Adena -->
		<ingredient count="161659000" id="57" />
		<production count="1" id="80258" />
	</item>
	<item>
		<!-- Adena -->
		<ingredient count="161659000" id="57" />
		<production count="1" id="80259" />
	</item>
	<item>
		<!-- Adena -->
		<ingredient count="161659000" id="57" />
		<production count="1" id="80260" />
	</item>
	<item>
		<!-- Adena -->
		<ingredient count="161659000" id="57" />
		<production count="1" id="80327" />
	</item>
	<item>
		<!-- Adena -->
		<ingredient count="161659000" id="57" />
		<production count="1" id="80328" />
	</item>
	<item>
		<!-- Adena -->
		<ingredient count="161659000" id="57" />
		<production count="1" id="80329" />
	</item>
</list>