<?xml version="1.0" encoding="UTF-8"?>
<list isChanceMultisell="true" xmlns:xsi="http://www.w3.org/2001/XMLSchema-instance" xsi:noNamespaceSchemaLocation="../xsd/multisell.xsd">
	<npcs>
		<npc>34445</npc> <!-- Accessory Artisan Denign -->
	</npcs>
	<item>
		<ingredient id="47214" count="1" /> <!-- Ring of Creation -->
		<ingredient id="47219" count="1" /> <!-- Source of the Emperor -->
		<production id="47215" count="1" chance="0" /> <!-- Ring of Authority -->
		<production id="47215" count="1" chance="5" /> <!-- Ring of Authority -->
		<production id="47214" count="1" chance="95" /> <!-- Ring of Creation -->
	</item>
	<item>
		<ingredient id="47214" count="1" /> <!-- Ring of Creation -->
		<ingredient id="47219" count="1" /> <!-- Source of the Emperor -->
		<production id="47217" count="1" chance="0" /> <!-- Ring of the Truth -->
		<production id="47217" count="1" chance="5" /> <!-- Ring of the Truth -->
		<production id="47214" count="1" chance="95" /> <!-- Ring of Creation -->
	</item>
	<item>
		<ingredient id="47217" count="1" /> <!-- Ring of the Truth -->
		<ingredient id="47219" count="1" /> <!-- Source of the Emperor -->
		<production id="47218" count="1" chance="0" /> <!-- Ring of the Truth-Seeker -->
		<production id="47218" count="1" chance="5" /> <!-- Ring of the Truth-Seeker -->
		<production id="47219" count="40" chance="95" /> <!-- Source of the Emperor -->
	</item>
	<item>
		<ingredient id="47215" count="1" /> <!-- Ring of Authority -->
		<ingredient id="47219" count="1" /> <!-- Source of the Emperor -->
		<production id="47216" count="1" chance="0" /> <!-- Ruler's Ring of Authority -->
		<production id="47216" count="1" chance="5" /> <!-- Ruler's Ring of Authority -->
		<production id="47219" count="40" chance="95" /> <!-- Source of the Emperor -->
	</item>
</list>