<?xml version="1.0" encoding="UTF-8"?>
<list xmlns:xsi="http://www.w3.org/2001/XMLSchema-instance" xsi:noNamespaceSchemaLocation="../xsd/multisell.xsd">
	<npcs>
		<npc>33946</npc> <!-- Adventure Guildsman -->
	</npcs>
	<item>
		<ingredient id="17746" count="20" /> <!-- Seal of Spirit -->
		<production id="18347" count="1" /> <!-- Talisman (R99-grade) - Critical Damage (Active) -->
	</item>
	<item>
		<ingredient id="17746" count="20" /> <!-- Seal of Spirit -->
		<production id="18351" count="1" /> <!-- Talisman (R99-grade) - Critical P. Def. (Active) -->
	</item>
	<item>
		<ingredient id="17746" count="20" /> <!-- Seal of Spirit -->
		<production id="18319" count="1" /> <!-- Talisman (R99-grade) - P. Atk. (Active) -->
	</item>
	<item>
		<ingredient id="17746" count="20" /> <!-- Seal of Spirit -->
		<production id="18323" count="1" /> <!-- Talisman (R99-grade) - P. Def. (Active) -->
	</item>
	<item>
		<ingredient id="17746" count="20" /> <!-- Seal of Spirit -->
		<production id="18327" count="1" /> <!-- Talisman (R99-grade) - M. Atk. (Active) -->
	</item>
	<item>
		<ingredient id="17746" count="20" /> <!-- Seal of Spirit -->
		<production id="18331" count="1" /> <!-- Talisman (R99-grade) - M. Def. (Active) -->
	</item>
	<item>
		<ingredient id="17746" count="20" /> <!-- Seal of Spirit -->
		<production id="18335" count="1" /> <!-- Talisman (R99-grade) - HP (Active) -->
	</item>
	<item>
		<ingredient id="17746" count="20" /> <!-- Seal of Spirit -->
		<production id="18339" count="1" /> <!-- Talisman (R99-grade) - MP (Active) -->
	</item>
	<item>
		<ingredient id="17746" count="20" /> <!-- Seal of Spirit -->
		<production id="18343" count="1" /> <!-- Talisman (R99-grade) - CP (Active) -->
	</item>
	<item>
		<ingredient id="17746" count="20" /> <!-- Seal of Spirit -->
		<production id="18352" count="1" /> <!-- Talisman (R-grade) - M. Critical (Active) -->
	</item>
	<item>
		<ingredient id="17746" count="20" /> <!-- Seal of Spirit -->
		<production id="18353" count="1" /> <!-- Talisman (R-grade) - P. Accuracy (Active) -->
	</item>
	<item>
		<ingredient id="17746" count="20" /> <!-- Seal of Spirit -->
		<production id="18354" count="1" /> <!-- Talisman (R-grade) - M. Accuracy (Active) -->
	</item>
	<item>
		<ingredient id="17746" count="20" /> <!-- Seal of Spirit -->
		<production id="18355" count="1" /> <!-- Talisman (R-grade) - Evasion (Active) -->
	</item>
	<item>
		<ingredient id="17746" count="20" /> <!-- Seal of Spirit -->
		<production id="18356" count="1" /> <!-- Talisman (R-grade) - M. Evasion (Active) -->
	</item>
	<item>
		<ingredient id="17746" count="20" /> <!-- Seal of Spirit -->
		<production id="18357" count="1" /> <!-- Talisman (R-grade) - P. Critical Rate (Active) -->
	</item>
	<item>
		<ingredient id="17746" count="20" /> <!-- Seal of Spirit -->
		<production id="18358" count="1" /> <!-- Talisman (R-grade) - Critical Evasion (Active) -->
	</item>
	<item>
		<ingredient id="17746" count="20" /> <!-- Seal of Spirit -->
		<production id="33768" count="1" /> <!-- Talisman (R-grade) - Damage Reflect Resistance (Active) -->
	</item>
	<item>
		<ingredient id="17746" count="20" /> <!-- Seal of Spirit -->
		<production id="33470" count="1" /> <!-- Special Talisman - M. Def. (Active) -->
	</item>
	<item>
		<ingredient id="17746" count="20" /> <!-- Seal of Spirit -->
		<production id="33471" count="1" /> <!-- Special Talisman - Ranged Attack Resistance (Active) -->
	</item>
	<item>
		<ingredient id="17746" count="20" /> <!-- Seal of Spirit -->
		<production id="32247" count="1" /> <!-- Talisman (R-grade) - Remove Debuff (Active) -->
	</item>
	<item>
		<ingredient id="17746" count="20" /> <!-- Seal of Spirit -->
		<production id="34622" count="1" /> <!-- Talisman (R-grade) - Half-kill/Lethal Strike Resistance (Active) -->
	</item>
</list>